{
  "schema_version": "investment-opportunity-comparison/v1", "record_type": "InvestmentOpportunityComparisonInput", "comparison_id": "synthetic-income-property", "label": "Synthetic income property", "as_of_date": "2026-08-25", "base_currency": "EUR", "capital_amount": "50000", "horizon_years": 3,
  "assumptions": [{"assumption_id": "synthetic", "version": "v1", "source": "fixture"}], "provenance": [{"origin": "synthetic fixture"}],
  "primary": {"alternative_id": "income-property", "label": "Income property", "capital_amount": "50000", "horizon_years": 3, "provenance": [{"origin": "synthetic adapter output"}], "scenarios": [
    {"scenario_type": "base", "label": "Base", "provenance": [{"origin": "synthetic"}], "annual_equity_cash_flow": "3000", "net_exit_value": "52000", "annual_owner_hours": "30", "annual_owner_time_cost": "900", "household_constraints": {"liquidity_reserve_required": "20000", "liquid_assets_after_commitment": "25000", "concentration_limit": "0.50", "concentration_after_commitment": "0.35", "retirement_work_exit_cash_flow_impact": "3000", "reversibility": "medium"}},
    {"scenario_type": "upside", "label": "Upside", "provenance": [{"origin": "synthetic"}], "stress_factors": [{"factor": "rent", "direction": "up", "value": "0.10", "unit": "rate"}], "annual_equity_cash_flow": "5000", "net_exit_value": "58000", "annual_owner_hours": "30", "annual_owner_time_cost": "900", "household_constraints": {"liquidity_reserve_required": "20000", "liquid_assets_after_commitment": "27000", "concentration_limit": "0.50", "concentration_after_commitment": "0.35", "retirement_work_exit_cash_flow_impact": "5000", "reversibility": "medium"}},
    {"scenario_type": "adverse", "label": "Adverse", "provenance": [{"origin": "synthetic"}], "stress_factors": [{"factor": "occupancy", "direction": "down", "value": "0.20", "unit": "rate"}], "annual_equity_cash_flow": "-2000", "net_exit_value": "40000", "annual_owner_hours": "45", "annual_owner_time_cost": "1350", "household_constraints": {"liquidity_reserve_required": "20000", "liquid_assets_after_commitment": "15000", "concentration_limit": "0.50", "concentration_after_commitment": "0.60", "retirement_work_exit_cash_flow_impact": "-2000", "reversibility": "low"}}
  ]}, "benchmark": {"alternative_id": "cash", "label": "Cash", "capital_amount": "50000", "horizon_years": 3, "provenance": [{"origin": "synthetic benchmark"}], "scenarios": [{"scenario_type": "base", "label": "Base", "provenance": [{"origin": "synthetic"}], "annual_equity_cash_flow": "1000", "net_exit_value": "50000", "annual_owner_hours": "0", "annual_owner_time_cost": "0"}]}
}
