{
  "schema_version": "investment-opportunity-comparison/v1", "record_type": "InvestmentOpportunityComparisonInput", "comparison_id": "synthetic-camper", "label": "Synthetic camper", "as_of_date": "2026-08-25", "base_currency": "EUR", "capital_amount": "50000", "horizon_years": 3,
  "assumptions": [{"assumption_id": "synthetic", "version": "v1", "source": "fixture"}], "provenance": [{"origin": "synthetic fixture"}],
  "primary": {"alternative_id": "camper", "label": "Camper", "capital_amount": "50000", "horizon_years": 3, "provenance": [{"origin": "synthetic adapter output"}], "scenarios": [
    {"scenario_type": "base", "label": "Base", "provenance": [{"origin": "synthetic"}], "annual_equity_cash_flow": "2500", "net_exit_value": "47000", "annual_owner_hours": "35", "annual_owner_time_cost": "1050", "household_constraints": {"liquidity_reserve_required": "20000", "liquid_assets_after_commitment": "23000", "concentration_limit": "0.50", "concentration_after_commitment": "0.30", "retirement_work_exit_cash_flow_impact": "2500", "reversibility": "medium"}},
    {"scenario_type": "upside", "label": "Upside", "provenance": [{"origin": "synthetic"}], "stress_factors": [{"factor": "rental_days", "direction": "up", "value": "20", "unit": "days"}], "annual_equity_cash_flow": "4000", "net_exit_value": "49000", "annual_owner_hours": "35", "annual_owner_time_cost": "1050", "household_constraints": {"liquidity_reserve_required": "20000", "liquid_assets_after_commitment": "24000", "concentration_limit": "0.50", "concentration_after_commitment": "0.30", "retirement_work_exit_cash_flow_impact": "4000", "reversibility": "medium"}},
    {"scenario_type": "adverse", "label": "Adverse", "provenance": [{"origin": "synthetic"}], "stress_factors": [{"factor": "major_repair", "direction": "up", "value": "3000", "unit": "EUR"}], "annual_equity_cash_flow": "-1500", "net_exit_value": "35000", "annual_owner_hours": "50", "annual_owner_time_cost": "1500", "household_constraints": {"liquidity_reserve_required": "20000", "liquid_assets_after_commitment": "15000", "concentration_limit": "0.50", "concentration_after_commitment": "0.60", "retirement_work_exit_cash_flow_impact": "-1500", "reversibility": "low"}}
  ]}, "benchmark": {"alternative_id": "portfolio", "label": "Portfolio", "capital_amount": "50000", "horizon_years": 3, "provenance": [{"origin": "synthetic benchmark"}], "scenarios": [{"scenario_type": "base", "label": "Base", "provenance": [{"origin": "synthetic"}], "annual_equity_cash_flow": "1000", "net_exit_value": "50000", "annual_owner_hours": "0", "annual_owner_time_cost": "0"}]}
}
